 Agencia Nacional de Investigación e Innovación|Agencia Nacional de Investigación e Innovación|3||||||||
 ANII, validación técnica y de idea de negocios|Agencia Nacional de Investigación e Innovación|3||||||||
 Fundación IRAUy - Institut Pasteur de Montevideo|Fundación IRAUy|9|Institut Pasteur de Montevideo|1||||||
 K&M, Río Grande do Sul- Brasil|K&M|12||||||||
 Lab. Celsius mediante un proyecto PDT|Laboratorio Celsius|5||||||||
 PNUD-FOMIN - Programa de Modernización de las RRLL en el Uruguay|Programa de las Naciones Unidas para el Desarrollo|10|Fondo Multilateral de Inversiones|10|Programa de Modernización de las RRLL en el Uruguay|1||||
 Programa de Desarrollo de las Ciencias Básicas /  Direccion Nacional de Recursos Acuaticos /Apoyo financiero|Programa de Desarrollo de las Ciencias Básicas|1|Direccion Nacional de Recursos Acuaticos |3||||||
Agencia Nacional de Investigación e Innovación|Agencia Nacional de Investigación e Innovación|3||||||||
ANII, validación técnica y de idea de negocios|Agencia Nacional de Investigación e Innovación|3||||||||
Fundación IRAUy - Institut Pasteur de Montevideo|Fundación IRAUy|9|Institut Pasteur de Montevideo|1||||||
K&M, Río Grande do Sul- Brasil|K&M|12||||||||
Lab. Celsius mediante un proyecto PDT|Laboratorio Celsius|5||||||||
PNUD-FOMIN - Programa de Modernización de las RRLL en el Uruguay|Programa de las Naciones Unidas para el Desarrollo|10|Fondo Multilateral de Inversiones|10|Programa de Modernización de las RRLL en el Uruguay|1||||
Programa de Desarrollo de las Ciencias Básicas /  Direccion Nacional de Recursos Acuaticos /Apoyo financiero|Programa de Desarrollo de las Ciencias Básicas|1|Direccion Nacional de Recursos Acuaticos |3||||||
3DMusic - LATU|3DMusic|12|Laboratorio Tecnológico del Uruguay |1||||||
A.N.I.I.|Agencia Nacional de Investigación e Innovación|3||||||||
abb|ABB|8||||||||
ABENGOA Energy Crops|ABENGOA Energy Crops|8||||||||
Abstracta|ABSTRACTA SRL|5||||||||
Abstracta, Artech|ABSTRACTA SRL|5|Artech Consultores SRL|5||||||
ACAC|ACAC|5||||||||
Academia de Francia en España - Casa de Velázquez|Academia de Francia en España - Casa de Velázquez|2||||||||
ACAS / Igalia|ACAS|8|Igalia|8||||||
Accelerated Genetics (USA)/University College Dublin (UCD)|Accelerated Genetics|8|University College Dublin|2||||||
Acequia Innova SLL|ACEQUIA INNOVA |8||||||||
ADAI - Cooperación Iberoamericana|Programa ADAI|2||||||||
ADAI/Fondo Clemente Estable/CSIC|Programa ADAI|2|Agencia Nacional de Investigación e Innovación|3|Comisión Sectorial de Investigación Científica|1||||
Administración de Ferrocarriles del Estado|Administración de Ferrocarriles del Estado|3||||||||
Administración de los Servicios de Salud del Estado (ASSE)|Administración de los Servicios de Salud del Estado |3||||||||
Administración Nacional de Correos (ANC)|Administración Nacional de Correos |3||||||||
Administración Nacional de Telecomunicaciones (Antel)|Administración Nacional de Telecomunicaciones|4||||||||
Administración Nacional de Usinas y Transmisiones Eléctricas, UTE|Administración Nacional de Usinas y Transmisiones Eléctricas|4||||||||
ADP SA|ADP SA|5||||||||
AECID|Agencia Española de Cooperación Internacional para el Desarrollo|10||||||||
AECID (Agencia Española de Cooperación Internacional y Desarrollo)|Agencia Española de Cooperación Internacional para el Desarrollo|10||||||||
AECID, en convenio SODRE/UdelAR|Agencia Española de Cooperación Internacional para el Desarrollo|10|SODRE|3|Universidad de la República|1||||
aecid, IMM|Agencia Española de Cooperación Internacional para el Desarrollo|10|Intendencia de Montevideo|3||||||
Afratur S.A.|Afratur S.A. |5||||||||
AFRATUR S.A.-YOUNG- Río Negro|Afratur S.A.|5||||||||
Agencia Española de Cooperación Internacional para el Desarrollo (AECID)|Agencia Española de Cooperación Internacional para el Desarrollo|10||||||||
Agencia Española de Cooperación Internacional para el Desarrollo; Intendencia Municipal de Montevideo|Agencia Española de Cooperación Internacional para el Desarrollo|10|Intendencia de Montevideo|3||||||
Agencia Española de Cooperación para el Desarrollo (AECID)|Agencia Española de Cooperación Internacional para el Desarrollo|10||||||||
Agencia Nacional de Investigación e Innovación|Agencia Nacional de Investigación e Innovación|3||||||||
Agencia Nacional de Investigación e Innovación (ANII)|Agencia Nacional de Investigación e Innovación|3||||||||
Agencia Nacional de Investigación e Innovación - Fondo María Viñas|Agencia Nacional de Investigación e Innovación|3||||||||
Agencia Nacional de Investigación e Innovación, ANII|Agencia Nacional de Investigación e Innovación|3||||||||
Agenda Metropolitana|Agenda Metropolitana|3||||||||
AGESIC|Agencia de Gobierno Electrónico y Sociedad de la Información y del Conocimiento|3||||||||
AGESIC - Uruguay|Agencia de Gobierno Electrónico y Sociedad de la Información y del Conocimiento|3||||||||
Agrocomunicaciones S.A.|Agro Comunicaciones S.A.|9||||||||
Agroindustria El Rincón|Agroindustria El Rincón|12||||||||
AGROMIL, INIA e MGAP|Agromil Ltda.|5|Instituto Nacional de Investigación Agropecuaria |1|Ministerio de Ganadería Agricultura y Pesca |3||||
Agrotech|Agrotech SRL |5||||||||
Agrotech, Biosur, Semillas Santa Rosa.|Agrotech SRL |5|Laboratorio BioSur|5|Centro de Investigación Hortifrutícola Semillas Santa Rosa S.A. |5||||
Alassio SA|Alassio SA |5||||||||
Alassio SA - BQN|Alassio SA |5|BQN|5||||||
Alassio SA, LATU|Alassio SA |5|Laboratorio Tecnológico del Uruguay |1||||||
ALFA (América Latina Formación Académica)|América Latina Formación Académica|10||||||||
ALFA - Unión Europea / UDELAR|América Latina Formación Académica|10|Universidad de la República|1||||||
ALUR|Alcoholes del Uruguay |4||||||||
American Chemical|American Chemicals|8||||||||
AMSUD - Pasteur|AMSUD - Pasteur|1||||||||
AMSUD-Pasteur / Facultad de Ingeniería - UdelaR|AMSUD - Pasteur|1|Facultad de Ingeniería|1||||||
ANCAP|Administración Nacional de Combustibles Alcohol y Portland |4||||||||
ANCAP, Uruguay.|Administración Nacional de Combustibles Alcohol y Portland |4||||||||
ANDE - Agencia Nacional de Desarrollo|Agencia Nacional de Desarrollo|3||||||||
ANEP / PEDECIBA|Administración Nacional de Educación Pública |3|Programa de Desarrollo de las Ciencias Básicas|1||||||
ANEP-AGESIC|Administración Nacional de Educación Pública |3|Agencia de Gobierno Electrónico y Sociedad de la Información y del Conocimiento|3||||||
ANEP-Antel|Administración Nacional de Educación Pública |3|Administración Nacional de Telecomunicaciones|4||||||
ANEP-CND|Administración Nacional de Educación Pública |3|Corporación Nacional para el Desarrollo|3||||||
ANEP-DIEE|Departamento de Investigación y Estadística Educativa|3||||||||
ANEP-DIEE - AGESIC|Departamento de Investigación y Estadística Educativa|3|Agencia de Gobierno Electrónico y Sociedad de la Información y del Conocimiento|3||||||
ANEP-MEMFOD, Ministerio de Educación y Cultura|Programa de Modernización de la Educación Media y la Formación Docente |3||||||||
ANII|Agencia Nacional de Investigación e Innovación|3||||||||
ANII (FMV)|Agencia Nacional de Investigación e Innovación|3||||||||
ANII (no financiado)|Agencia Nacional de Investigación e Innovación|3||||||||
ANII - ALUR-ANCAP|Agencia Nacional de Investigación e Innovación|3|Alcoholes del Uruguay |4|Administración Nacional de Combustibles Alcohol y Portland |4||||
ANII - FIUM - FJR - FING/UDELAR|Agencia Nacional de Investigación e Innovación|3|Universidad de Montevideo|1|Fundación Julio Ricaldoni |1||||
ANII - IDl_X_2016_1_126768|Agencia Nacional de Investigación e Innovación|3||||||||
ANII - Ing. Manuel Berger|Agencia Nacional de Investigación e Innovación|3||||||||
ANII - Institut Pasteur Montevideo|Agencia Nacional de Investigación e Innovación|3|Institut Pasteur de Montevideo |2||||||
ANII / Unidad de Extensión de la Facultad de Ingeniería|Agencia Nacional de Investigación e Innovación|3|Facultad de Ingeniería|1||||||
ANII a potencial innovador|Agencia Nacional de Investigación e Innovación|3||||||||
ANII CLEMENTE ESTABLE|Agencia Nacional de Investigación e Innovación|3||||||||
ANII EQUIPAMIENTO CIENTIFICO DE PUNTA, proyecto código EQC_X_2013_1_06|Agencia Nacional de Investigación e Innovación|3||||||||
ANII parcialmente (beca de doctorado a Lucía Spangenberg)|Agencia Nacional de Investigación e Innovación|3||||||||
ANII y Lage y Cia|Agencia Nacional de Investigación e Innovación|3|Lage y Cía |5||||||
ANII y PRONDIL S. A.|Agencia Nacional de Investigación e Innovación|3|Prondil S.A. |5||||||
ANII, Artech|Agencia Nacional de Investigación e Innovación|3|Artech Consultores S.R.L |5||||||
ANII, COST Action, EU and IP|Agencia Nacional de Investigación e Innovación|3|COST Action|8||||||
ANII, Cropscanner SRL|Agencia Nacional de Investigación e Innovación|3|Crop Scanner SRL|5||||||
ANII, CSIC|Agencia Nacional de Investigación e Innovación|3|Comisión Sectorial de Investigación Científica|1||||||
ANII, CSIC, PEDECIBA|Agencia Nacional de Investigación e Innovación|3|Comisión Sectorial de Investigación Científica|1|Programa de Desarrollo de las Ciencias Básicas|1||||
ANII, Fundación Julio Ricaldoni|Agencia Nacional de Investigación e Innovación|3|Fundación Julio Ricaldoni |1||||||
ANII, INIA.|Agencia Nacional de Investigación e Innovación|3|Instituto Nacional de Investigación Agropecuaria |1||||||
ANII, LATU|Agencia Nacional de Investigación e Innovación|3|Laboratorio Tecnológico del Uruguay |1||||||
ANII, MEC|Agencia Nacional de Investigación e Innovación|3|Ministerio de Educación y Cultura|3||||||
ANII, PEDECIBA, Fundación IRAUy|Agencia Nacional de Investigación e Innovación|3|Programa de Desarrollo de las Ciencias Básicas|1|Fundación IRAUy|9||||
ANII, Proyecto Biovalor, Intendencia de San José|Agencia Nacional de Investigación e Innovación|3|Proyecto Biovalor|10|Intendencia de San José|3||||
ANII, Universidad Católica del Uruguay|Agencia Nacional de Investigación e Innovación|3|Universidad  Católica del Uruguay|1||||||
ANII- Empresa Prondil SA|Agencia Nacional de Investigación e Innovación|3|Prondil S.A. |5||||||
ANII-Iniciación Investigación|Agencia Nacional de Investigación e Innovación|3||||||||
ANII-UdelaR-PEDECIBA|Agencia Nacional de Investigación e Innovación|3|Programa de Desarrollo de las Ciencias Básicas|1||||||
ANII/MTOP-Vialidad/Facultad de Ciencias-UdelaR|Agencia Nacional de Investigación e Innovación|3|Ministerio de Transporte y Obras Públicas|3|Facultad de Ciencias|1||||
ANII; CSIC; ASOLUR|Agencia Nacional de Investigación e Innovación|3|Comisión Sectorial de Investigación Científica|1|ASOLUR|9||||
ANKA|ANKA|8||||||||
ANTEL|Administración Nacional de Telecomunicaciones|4||||||||
ANTEL - FACULTAD DE INGENIERÍA|Administración Nacional de Telecomunicaciones|4|Facultad de Ingeniería|1||||||
ANTEL : Administración NAcional de Telecomunicaciones - URUGUAY|Administración Nacional de Telecomunicaciones|4||||||||
ANTEL, Administración Nacional de Telecomunicaciones|Administración Nacional de Telecomunicaciones|4||||||||
ANTEL, UEFI|Administración Nacional de Telecomunicaciones|4||||||||
Anwary SA|Anwary SA |8||||||||
APEX|Programa Apex- Cerro |1||||||||
APOTEKNOS DERMA|Apoteknos Derma|8||||||||
Architectural Association, UK|Architectural Association School of Architecture|2||||||||
Archmedium|Archmedium|8||||||||
Área Básica del Departamento de Neonatología - Universidad de la República|Universidad de la República|1||||||||
Arquitecturas Colectivas|Arquitecturas Colectivas|9||||||||
Arte Quesero S.R.L|Arte Quesero SRL|5||||||||
Arte, café, libros, ETC. Toluca|Arte, café, libros, ETC|8||||||||
ARU - INML  - SCHU - FAGRO - INIA - INALE|Asociación Rural del Uruguay|51|Facultad de Agronomía|1|Instituto Nacional de Investigación Agropecuaria |1|Instituto Nacional de la Leche|3||
ARU-INML-SCHU-FAGRO-INIA|Asociación Rural del Uruguay|51|Facultad de Agronomía|1|Instituto Nacional de Investigación Agropecuaria |1||||
Asociación de la Prensa del Uruguay|Asociación de la Prensa del Uruguay|9||||||||
Asociacion de Porudctores dePapa semilla de San Jose|Asociación de Productores de Papa|51||||||||
Asociación Honoraria de Salvamentos Marítimos y Fluviales (ADES)|Asociación Honoraria de Salvamentos Marítimos y Fluviales|9||||||||
Asociación Italia-Nicaragua|Asociación Italia-Nicaragua|9||||||||
Asociación Nacional de Telecomunicaciones (ANTEL), Unidad de Extensión de la Facultad de Ingeniería (UEFI)|Administración Nacional de Telecomunicaciones|4|Facultad de Ingeniería|1||||||
Asociación Uruguaya de Antropología Social|Asociación Uruguaya de Antropología Social|9||||||||
Asociación Uruguaya de Colegios Católicos (AUDEC)|Asociación Uruguaya de Colegios Católicos|9||||||||
ASSE|Administración de los Servicios de Salud del Estado |3||||||||
Associazione Italia-Nicaragua|Asociación Italia-Nicaragua|9||||||||
ATGen Sistemas Moleculares|ATGen|5||||||||
ATgen Sistemas Moleculares / Proyecto PDT S/E/INI/06/054|ATGen|5|Dirección de Innovación, Ciencia y Tecnología |3||||||
autopublicación||||||||||
AVEX S.A.|Avex SA|8||||||||
Ayuntamiento de Madrid. Colegio Oficial de Arquitectos de Madrid.|Colegio Oficial de Arquitectos de Madrid|10||||||||
Ayuntamiento de Montilla, Córdoba (España).|Ayuntamiento de Montilla, Córdoba|10||||||||
Ayuntamiento de San José de la Rinconada, Sevilla.|Ayuntamiento de San José de la Rinconada, Sevilla|10||||||||
Bader Uruguay|Bader, Uruguay|8||||||||
Banco Central del Uruguay|Banco Central del Uruguay|3||||||||
Banco Comercial|Banco Comercial|8||||||||
Banco Interamericano de Desarrollo|Banco Interamericano de Desarrollo|10||||||||
Banco Interamericano de Desarrollo - DICYT|Banco Interamericano de Desarrollo|10|Dirección de Innovación, Ciencia y Tecnología |3||||||
Banco Mundial|Banco Mundial|10||||||||
Banco Mundial - Programa Infodev|Banco Mundial|10||||||||
Banco Mundial, MGAP, BSE.|Banco Mundial|10|Ministerio de Ganadería, Agricultura y Pesca|3|Banco de Seguros del Estado|3||||
Barraca Deambrossi|Barraca Deambrosi|5||||||||
Beethoven-Haus|Beethoven-Haus|9||||||||
Berliner Künstlerprogramm des DAAD|Berliner Künstlerprogramm des DAAD|8||||||||
Bicimáquinas,  Imagen y Palabra|Bicimáquinas|12|Imagen y Palabra|12||||||
BID|Banco Interamericano de Desarrollo|10||||||||
BID - Universidad Católica del Uruguay|Banco Interamericano de Desarrollo|10|Universidad  Católica del Uruguay|1||||||
BID II|Banco Interamericano de Desarrollo|10||||||||
BID, CONICYT|Banco Interamericano de Desarrollo|10|Consejo Nacional de Innovación Ciencia y Tecnología (CONICYT) |3||||||
Bid-Conicyt Proyecto 153 - registrada en Biblioteca Nacional|Banco Interamericano de Desarrollo|10|Consejo Nacional de Innovación Ciencia y Tecnología (CONICYT) |3||||||
BID-PROLID-CEM Argentina|Banco Interamericano de Desarrollo|10|CEM|7||||||
BID/MGAP|Banco Interamericano de Desarrollo|10|Ministerio de Ganadería, Agricultura y Pesca|3||||||
Bio High-Tecnology Laboratories|Bio High-Tecnology Laboratories|5||||||||
Biofer Ltda y cooperacion con AID y Rutgers University|Biofer Ltda|5|Rutgers Office of Financial Aid|2||||||
Bloop Festival / City University of Hong Kong|Bloop Festival|9|City University of Hong Kong|2||||||
Botica del Señor|Botica del Señor SRL|5||||||||
Botica del Señor S.R.L.|Botica del Señor SRL|5||||||||
Brasil - PROSUL|PROSUL|8||||||||
Buda Musique (France)|Buda Musique|8||||||||
CALCAR|CALCAR|5||||||||
CALPROSE|Calprose|5||||||||
Canal 12, Contenidos producciones|Canal 12|5||||||||
Casa de Velázquez|Academia de Francia en España - Casa de Velázquez|2||||||||
CASMU IAMPP|CASMU|7||||||||
cátedra de microbiología||||||||||
CATEDRA DE tOXICOLOGIA E HIGIENE AMBIENTAL|Facultad de Química|1||||||||
CCC del Uruguay|CCC del Uruguay|5||||||||
CCC S.A.|CCC del Uruguay|5||||||||
CCC S.A. / Proyecto FINTEC|CCC del Uruguay|5||||||||
cdf|Centro de Fotografía|3||||||||
CDM (Centro de Documentación Musical Lauro Ayestarán)|Centro Nacional de Documentación Lauro Ayestarán|3||||||||
CEE y Universidad de Pisa|Comunidad Económica Europea|10|Universidad de Pisa|2||||||
CEIBAL|Plan CEIBAL|3||||||||
CEIP y MIDES- Uruguay|Consejo de Educación Inicial y Primaria  |3|Ministerio de Desarrollo Social|3||||||
CEMAGREF, Francia|CEMAGREF|10||||||||
CENTA - España|CENTA|10||||||||
CENTA-España|CENTA|10||||||||
Centro Ceibal|Plan CEIBAL|3||||||||
Centro Cultural de España|Centro Cultural de España|9||||||||
Centro Cultural de España en uruguay|Centro Cultural de España|9||||||||
Centro Cultural España|Centro Cultural de España|9||||||||
Centro Cultural Kirchner|Centro Cultural Néstor Kirchner |9||||||||
Centro Cultural San Felipe, Montevideo.|Centro Cultural San Felipe|11||||||||
Centro de Ensayos de Software|Centro de Ensayos de Software|5||||||||
Centro de Estudios para América Latina UAM|Centro de Estudios para América Latina (UAM)|2||||||||
Centro de Formación Permanente. Instituto Agropecuario Salesiano y Lactodiagnostico Sur|Centro de Formación Permanente|2|Instituto Agropecuario Salesiano|11|Lactodiagnostico Sur SRL|8||||
Centro de Fotografía de Montevideo|Centro de Fotografía|3||||||||
Centro de Investigación en Artes Musicales y Escémnicas del Litoral Noroeste, UdelaR|Centro de Investigación de Artes Musicales y Escénicas del Litoral Noroeste-UDELAR|1||||||||
Centro de Investigaciones Agrícolas Alberto Boerger|Centro de Investigaciones Agrícolas Alberto Boerger|1||||||||
Centro de Recursos Audiovisuales del Centro Cultural de España en Montevideo|Centro de Recursos Audiovisuales- Centro Cultural de España en Montevideo|9||||||||
Centro de Rehabilitación Teletón|Centro de Rehabilitación Teletón|7||||||||
Centro Interdisciplinario de Respuesta al Cambio y a la Variabilidad Climática|Centro Interdisciplinario de Respuesta al Cambio y a la Variabilidad Climática|1||||||||
Centro Interdisciplinario para el Manejo Costero Integrado del Cono Sur|Centro Interdisciplinario para el Manejo Costero Integrado del Cono Sur|1||||||||
Centro Municipal de Exposiciones - SUBTE Montevideo|Centro Municipal de Exposiciones-SUBTE|3||||||||
Centro Municipal de Fotografía / Centro de exposiciones Subte / Arts Wales International|Centro de Fotografía|3|Centro Municipal de Exposiciones-SUBTE|3|Arts Wales International|9||||
Centro Superior de Deportes - Universidad Politécnica de Madrid|Centro Superior de Deportes|10|s-Universidad Politécnica de Madrid|2||||||
Centro Universitario de Tacuarembó-Rivera-Cerro Largo|Centro Universitario de Tacuarembó-Rivera-Cerro Largo-UDELAR|1||||||||
Cequimtox - Catedra de Toxicologia|Facultad de Química-UDELAR|1||||||||
CES|Consejo de Educación Secundaria-CES|3||||||||
CES-CERESO|Centro de Recursos para Estudiantes Sordos-CES|3||||||||
CFE|CFE|3||||||||
Chargeurs Textiles|Chargeurs Textiles (Francia)|8||||||||
Chargeurs Textiles (Francia)|Chargeurs Textiles (Francia)|8||||||||
Chipmate|Chipmate|8||||||||
CIAAB-MGAP|Centro de Investigaciones Agrícolas Alberto Boerger|1|Ministerio de Ganadería, Agricultura y Pesca|3||||||
CIAAB-MGAP, INIA|Centro de Investigaciones Agrícolas Alberto Boerger|1|Ministerio de Ganadería, Agricultura y Pesca|3|Instituto Nacional de Investigación Agropecuaria |1||||
Cibeles S.a|Cibeles SA|5||||||||
CIDEC|Facultad de Veterinaria-UDELAR|1||||||||
CIDEC/ Facultad de Veterinaria|Facultad de Veterinaria-UDELAR|1||||||||
Ciencia Viva, IMM|"Asociación Civil ""Ciencia Viva"""|9|Intendencia de Montevideo|3||||||
Ciencias Viva. IMM|"Asociación Civil ""Ciencia Viva"""|9|Intendencia de Montevideo|3||||||
City University of Hong Kong|City University of Hong Kong|2||||||||
CLACSO- Argentina|Consejo Latinoamericano de Ciencias Sociales (CLACSO)|10||||||||
CLAEH|CLAEH|1||||||||
CLAEH - PSC|CLAEH|1||||||||
Cliente particular||||||||||
Cliente privado.||||||||||
Clientes, Empresa propia||||||||||
Clínica MARKA|Clínica MARKA (ex)|5||||||||
Club Biguá de Villa Biarritz|Club Bigua|9||||||||
Club Malvín|Club Malvín|9||||||||
CNES|Centro Nacional de Estudios Espaciales (Francia)|10||||||||
CNPq|Conselho Nacional de Desenvolvimento Científico e Tecnológico|10||||||||
CNRS _Francia|Centre National de la Recherche Scientifique (CNRS)|10||||||||
COALEP|Colegio Nacional de Educación Profesional Técnica (México)|2||||||||
Cognitech, Inc. USA|Cognitech, Inc|8||||||||
ColCiencias|Departamento Administrativo de Ciencia, Tecnología e Innovación (COLCIENCIAS)|10||||||||
COLCIENCIAS - Fundación Centro de Investigación en Modelación Empresarial del Caribe  FCIMEC.|Departamento Administrativo de Ciencia, Tecnología e Innovación (COLCIENCIAS)|10||||||||
Colectivo Transit|Colectivo Transit|12||||||||
Colegio Federico García Lorca|Colegio Federico García Lorca|11||||||||
Colegio Juan Zorrilla (Hnos.Maristas)|Colegio Juan Zorrilla (Hnos.Maristas)|11||||||||
Colegio Oficial de Arquitectos de Canarias|Colegio Oficial de Arquitectos de Canarias|9||||||||
Colegio Seminario|Colegio Seminario|11||||||||
Colegio Seminario, CVX Uruguay|Colegio Seminario|11||||||||
Colegio y Liceo Pedro Poveda|Colegio y Liceo Pedro Poveda|11||||||||
COLEME|COLME Ltda|5||||||||
Colonvade|Colonvade SA|8||||||||
Columbia University|Columbia University|2||||||||
Comision 100 años Universidad de la República|Comision 100 años Universidad de la República|12||||||||
Comisión de Fomento de Escuela N° 137 Solar de Artigas de Carmelo|Comisión de Fomento de Escuela N° 137 Solar de Artigas de Carmelo|9||||||||
Comisión Económica para América Latina|Comisión Económica para América Latina y el Caribe|10||||||||
Comisión Europea|Comisión Europea|10||||||||
Comisión Sectorial de Educación Permanente - UDELAR|Comisión Sectorial de Educación Permanente-UDELAR|1||||||||
Comisión Sectorial de Enseñanza|Comisión Sectorial de Enseñanza-UDELAR|1||||||||
Comisión Sectorial de Enseñanza (CSE)|Comisión Sectorial de Enseñanza-UDELAR|1||||||||
Comisión Sectorial de Enseñanza de la UdelaR|Comisión Sectorial de Enseñanza-UDELAR|1||||||||
Comisión Sectorial de Enseñanza de la Universidad de la República|Comisión Sectorial de Enseñanza-UDELAR|1||||||||
Comisión Sectorial de Enseñanza, UdelaR|Comisión Sectorial de Enseñanza-UDELAR|1||||||||
Comisión Sectorial de Enseñanza- UDELAR|Comisión Sectorial de Enseñanza-UDELAR|1||||||||
Comisión Sectorial de Extensión y Actividades en el Medio|Comisión Sectorial de Extensión y Actividades en el Medio-UDELAR|1||||||||
Comisión Sectorial de Extension y Actividades en el Medio-UdelaR|Comisión Sectorial de Extensión y Actividades en el Medio-UDELAR|1||||||||
Comisión Sectorial de Extensión Y Actividades en el MEdio. CSEAM UDELAR|Comisión Sectorial de Extensión y Actividades en el Medio-UDELAR|1||||||||
Comisión Sectorial de Investigación Científica|Comisión Sectorial de Investigación Científica-UDELAR|1||||||||
Comisión Sectorial de Investigación Científica (Csic)|Comisión Sectorial de Investigación Científica-UDELAR|1||||||||
COMISIÓN SECTORIAL DE INVESTIGACIÓN CIENTIFICA (CSIC) - PROGRAMA DE APOYO A LA INVESTIGACIÓN ESTUDIANTIL (PAIE)|Comisión Sectorial de Investigación Científica-UDELAR|1||||||||
Comisión Sectorial de Investigación Científica (CSIC), de la UdeLAR a través de su programa artículo 2, Fondo Universitario para Contribuir a la comprensión Pública de Temas de Interés General|Comisión Sectorial de Investigación Científica-UDELAR|1||||||||
Comisión Sectorial de Investigación Científica (CSIC)-UdelaR|Comisión Sectorial de Investigación Científica-UDELAR|1||||||||
Comisión Sectorial de Investigación Científica (CSIC-UdelaR)|Comisión Sectorial de Investigación Científica-UDELAR|1||||||||
Comisión Sectorial de Investigación Científica - EUM - FCE|Comisión Sectorial de Investigación Científica-UDELAR|1|Escuela Universitaria de Música-UDELAR|1|Facultad de Ciencias Económicas y de Administración-UDELAR|1||||
Comisión Sectorial de Investigación Científica - Intendencia de Montevideo|Comisión Sectorial de Investigación Científica-UDELAR|1|Intendencia de Montevideo|3||||||
Comisión Sectorial de Investigación Científica - Sello Fonográfico Sondor|Comisión Sectorial de Investigación Científica-UDELAR|1|Sondor|5||||||
Comisión Sectorial de Investigación Científica CSIC|Comisión Sectorial de Investigación Científica-UDELAR|1||||||||
Comisión Sectorial de Investigación Científica de la UdelaR|Comisión Sectorial de Investigación Científica-UDELAR|1||||||||
Comisión Sectorial de Investigacion Científica de la Universidad de la República|Comisión Sectorial de Investigación Científica-UDELAR|1||||||||
Comisión Sectorial de Investigación Científica UDELAR|Comisión Sectorial de Investigación Científica-UDELAR|1||||||||
Comisión Sectorial de Investigación Científica  CSIC.  Udelar.|Comisión Sectorial de Investigación Científica-UDELAR|1||||||||
Comisión Sectorial de Investigación Científica, UDELAR|Comisión Sectorial de Investigación Científica-UDELAR|1||||||||
Comisión Sectorial de Investigación Científica-UdelaR|Comisión Sectorial de Investigación Científica-UDELAR|1||||||||
Comisión Sectorial de Investigación Científica: CSIC-UDELAR|Comisión Sectorial de Investigación Científica-UDELAR|1||||||||
Comisión Unesco, Montevideo Uruguay||||||||||
Como Arq. en Sección Investigación y Estadística de Dinavi, MVPS|Ministerio de Vivienda Ordenamiento Territorial y Medio Ambiente|3||||||||
Compañçia Color Persona|Compañçia Color Persona|12||||||||
Compañía Cibeles S.A.|Cibeles SA|5||||||||
Compañia FOrestal RMK|Compañia Forestal RMK|8||||||||
Compañía Nacional de Grafite|Nacional de Grafite|8||||||||
Compañía SALUS|Compañia Salus SA|5||||||||
